{
  "$schema": "./test-suite.schema.json",
  "suite": "skill-eng-maintainability",
  "version": "1.0.0",
  "description": "Validation test suite for all 14 maintainability rules (MAINT01–MAINT14). Covers violation detection, safe implementations, false-positive resistance, multi-stack examples, insufficient evidence, and root-cause duplicate consolidation.",
  "testCases": [
    {
      "id": "TC-001",
      "description": "MAINT01: Duplicated discount calculation and tax logic copied verbatim across domestic and commercial invoice handlers.",
      "ruleIds": ["MAINT01"],
      "technology": "Python",
      "inputFile": "validation/test-data/TC-001-duplication.py",
      "targetFunction": "calculate_invoice_total_domestic",
      "expected": {
        "findingsPresent": true,
        "findings": [
          {
            "ruleId": "MAINT01",
            "severity": "medium",
            "confidence": "high",
            "evidenceContains": ["discount", "tier", "tax", "duplicated"],
            "scoreImpact": -7
          }
        ]
      },
      "safeCounterpart": {
        "targetFunction": "calculate_invoice_total_safe",
        "expected": {
          "findingsPresent": false,
          "notes": "Shared apply_customer_discount helper encapsulates calculation."
        }
      }
    },
    {
      "id": "TC-002",
      "description": "MAINT02: Deeply nested conditionals (5 levels) in process_loan_application_complex obscuring business validation.",
      "ruleIds": ["MAINT02"],
      "technology": "Python",
      "inputFile": "validation/test-data/TC-002-complexity.py",
      "targetFunction": "process_loan_application_complex",
      "expected": {
        "findingsPresent": true,
        "findings": [
          {
            "ruleId": "MAINT02",
            "severity": "medium",
            "confidence": "high",
            "evidenceContains": ["nested", "conditionals", "complexity"],
            "scoreImpact": -7
          }
        ]
      },
      "safeCounterpart": {
        "targetFunction": "process_loan_application_safe",
        "expected": {
          "findingsPresent": false,
          "notes": "Flattened logic with guard clauses and early returns."
        }
      }
    },
    {
      "id": "TC-003",
      "description": "MAINT03: Ambiguous cryptic identifiers (proc_usr_lst, d, temp1, not_unverified) obscuring business domain purpose.",
      "ruleIds": ["MAINT03"],
      "technology": "Python",
      "inputFile": "validation/test-data/TC-003-naming.py",
      "targetFunction": "proc_usr_lst",
      "expected": {
        "findingsPresent": true,
        "findings": [
          {
            "ruleId": "MAINT03",
            "severity": "low",
            "confidence": "high",
            "evidenceContains": ["proc_usr_lst", "single-letter", "not_unverified"],
            "scoreImpact": -2
          }
        ]
      },
      "safeCounterpart": {
        "targetFunction": "filter_verified_high_value_accounts",
        "expected": {
          "findingsPresent": false,
          "notes": "Expressive domain-oriented naming clearly states intent."
        }
      }
    },
    {
      "id": "TC-004",
      "description": "MAINT04: God-method performing 5 distinct responsibilities (parsing, validation, payment, DB, email dispatch) with flag parameter.",
      "ruleIds": ["MAINT04"],
      "technology": "Python",
      "inputFile": "validation/test-data/TC-004-function-responsibility.py",
      "targetFunction": "process_checkout_god_method",
      "expected": {
        "findingsPresent": true,
        "findings": [
          {
            "ruleId": "MAINT04",
            "severity": "high",
            "confidence": "high",
            "evidenceContains": ["multiple responsibilities", "parsing", "payment", "database"],
            "scoreImpact": -15
          }
        ]
      },
      "safeCounterpart": {
        "targetFunction": "process_checkout_safe",
        "expected": {
          "findingsPresent": false,
          "notes": "Decomposed into focused functions with single responsibilities."
        }
      }
    },
    {
      "id": "TC-005",
      "description": "MAINT05: Hardcoded instantiation of concrete PostgresClient and StripeApiClient inside business service constructor.",
      "ruleIds": ["MAINT05"],
      "technology": "Python",
      "inputFile": "validation/test-data/TC-005-coupling.py",
      "targetClass": "BillingProcessorViolation",
      "expected": {
        "findingsPresent": true,
        "findings": [
          {
            "ruleId": "MAINT05",
            "severity": "high",
            "confidence": "high",
            "evidenceContains": ["PostgresClient", "StripeApiClient", "direct instantiation"],
            "scoreImpact": -15
          }
        ]
      },
      "safeCounterpart": {
        "targetClass": "BillingProcessorSafe",
        "expected": {
          "findingsPresent": false,
          "notes": "Dependencies injected as protocols/abstractions."
        }
      }
    },
    {
      "id": "TC-006",
      "description": "MAINT06: Low-cohesion omnibus class AppOmnibusManager grouping auth, inventory, PDF rendering, and marketing newsletters.",
      "ruleIds": ["MAINT06"],
      "technology": "Python",
      "inputFile": "validation/test-data/TC-006-cohesion.py",
      "targetClass": "AppOmnibusManager",
      "expected": {
        "findingsPresent": true,
        "findings": [
          {
            "ruleId": "MAINT06",
            "severity": "high",
            "confidence": "high",
            "evidenceContains": ["omnibus", "unrelated domains", "low cohesion"],
            "scoreImpact": -15
          }
        ]
      },
      "safeCounterpart": {
        "targetClass": "InventoryService",
        "expected": {
          "findingsPresent": false,
          "notes": "Cohesive single-purpose domain classes."
        }
      }
    },
    {
      "id": "TC-007",
      "description": "MAINT07: Generic exception swallowed completely with bare pass block, concealing database/network failure.",
      "ruleIds": ["MAINT07"],
      "technology": "Python",
      "inputFile": "validation/test-data/TC-007-error-handling.py",
      "targetFunction": "execute_transfer_violation",
      "expected": {
        "findingsPresent": true,
        "findings": [
          {
            "ruleId": "MAINT07",
            "severity": "high",
            "confidence": "high",
            "evidenceContains": ["swallowed exception", "bare except", "conceals failure"],
            "scoreImpact": -15
          }
        ]
      },
      "safeCounterpart": {
        "targetFunction": "execute_transfer_safe",
        "expected": {
          "findingsPresent": false,
          "notes": "Explicit exception chaining using 'from err' and diagnostic logging."
        }
      }
    },
    {
      "id": "TC-008",
      "description": "MAINT08: Scattered magic numbers (86400, 604800, 3600) and direct os.environ reads deep in business calculation.",
      "ruleIds": ["MAINT08"],
      "technology": "Python",
      "inputFile": "validation/test-data/TC-008-configuration.py",
      "targetFunction": "calculate_user_session_expiry_violation",
      "expected": {
        "findingsPresent": true,
        "findings": [
          {
            "ruleId": "MAINT08",
            "severity": "medium",
            "confidence": "high",
            "evidenceContains": ["magic numbers", "86400", "os.environ"],
            "scoreImpact": -7
          }
        ]
      },
      "safeCounterpart": {
        "targetFunction": "calculate_user_session_expiry_safe",
        "expected": {
          "findingsPresent": false,
          "notes": "Named constants and centralized typed settings dataclass."
        }
      }
    },
    {
      "id": "TC-009",
      "description": "MAINT09: Direct call to datetime.now() inside domain expiration logic preventing deterministic unit testing.",
      "ruleIds": ["MAINT09"],
      "technology": "Python",
      "inputFile": "validation/test-data/TC-009-testability.py",
      "targetClass": "TrialSubscriptionViolation",
      "expected": {
        "findingsPresent": true,
        "findings": [
          {
            "ruleId": "MAINT09",
            "severity": "medium",
            "confidence": "high",
            "evidenceContains": ["datetime.now", "system clock", "unmockable"],
            "scoreImpact": -7
          }
        ]
      },
      "safeCounterpart": {
        "targetClass": "TrialSubscriptionSafe",
        "expected": {
          "findingsPresent": false,
          "notes": "Injected clock provider callable enabling deterministic tests."
        }
      }
    },
    {
      "id": "TC-010",
      "description": "MAINT10: Speculative over-engineering: 4 layers of trivial proxy and factory wrappers for a basic 3-line string helper.",
      "ruleIds": ["MAINT10"],
      "technology": "Python",
      "inputFile": "validation/test-data/TC-010-abstraction.py",
      "targetFunction": "fetch_data_violation",
      "expected": {
        "findingsPresent": true,
        "findings": [
          {
            "ruleId": "MAINT10",
            "severity": "medium",
            "confidence": "high",
            "evidenceContains": ["over-engineering", "speculative indirection", "passthrough"],
            "scoreImpact": -7
          }
        ]
      },
      "safeCounterpart": {
        "targetFunction": "fetch_system_tags_safe",
        "expected": {
          "findingsPresent": false,
          "notes": "Pragmatic, straightforward function without needless layers."
        }
      }
    },
    {
      "id": "TC-011",
      "description": "MAINT11: Unreachable code following unconditional return and large commented-out historical calculation block.",
      "ruleIds": ["MAINT11"],
      "technology": "Python",
      "inputFile": "validation/test-data/TC-011-dead-code.py",
      "targetFunction": "calculate_tax_with_dead_code",
      "expected": {